{
  "version": 1,
  "current_task_id": null,
  "cycle_status": "idle",
  "last_planner_run_at": "2026-04-12T14:04:53.424Z",
  "last_worker_run_at": "2026-04-12T16:48:41.6200454Z",
  "last_result": "passed",
  "consecutive_worker_failures": 0,
  "needs_human_review": false,
  "open_blocker_count": 0
}
